{
  "$schema": "./workflow.schema.json",
  "specVersion": "1.0.0",
  "gates": {
    "onlineTtsConsent": {
      "appliesWhen": "實際使用的 TTS provider 為 edge-tts、azure、openai 或 elevenlabs",
      "check": "project.tts.consent.onlineTts == true",
      "blocks": ["tts"],
      "ask": "告知使用者：旁白文字將送至 <服務名稱> 進行語音合成。請使用者同意，或改選離線 provider（piper、system）或 manual 自行錄音。",
      "record": "project.tts.consent = { onlineTts: true, grantedAt }",
      "onDecline": "停下，請使用者選擇離線 provider 或 manual。"
    },
    "domEditConsent": {
      "appliesWhen": "scene 的 visual.capture.actions 含有 script 動作（錄製時修改頁面內容，例如在資料很少的報表頁填入示意資料）",
      "check": "visual.capture.domEditConsent.granted == true",
      "blocks": ["capture"],
      "ask": "告知使用者：這個頁面的資料太少，畫面會很空。說明打算在錄製時暫時改寫哪些內容（例如表格填入 12 筆示意訂單、圖表補上 6 個月的趨勢），只影響錄下來的畫面，不會改到產品或它的資料；畫面角落會標示「示意資料」。請使用者同意，或改用真實資料、使用者提供的截圖。",
      "record": "visual.capture.domEditConsent = { granted: true, grantedAt }（每個 scene 分別取得）",
      "onDecline": "不加 script 動作，照實錄製；或請使用者提供有資料的帳號畫面或截圖。"
    },
    "manimInstall": {
      "appliesWhen": "有 scene 的 visual.type 為 manim",
      "check": "pnpm run manim 找得到 Manim（VIDEO_MANIM、專案的 .venv 或 PATH 上的 manim；manim --version 成功）",
      "blocks": ["manim"],
      "ask": "告知使用者：這幾段要用 Manim（Python 動畫工具）畫，需要在專案裡安裝 Python 套件（約數百 MB）：uv venv .venv --python 3.12，接著 uv pip install --python .venv manim。Linux 另需系統套件 libcairo2-dev、libpango1.0-dev、pkg-config（要用 sudo，請使用者自己執行）；公式（MathTex、Tex）另需 LaTeX。請使用者同意安裝，或改用 motion-graphic。",
      "record": "不寫入 JSON；pnpm run manim 不再輸出 Manim is not installed 即成立",
      "onDecline": "把這幾段改成 motion-graphic（SVG / GSAP 動畫模組或 elements 排版），公式改用文字元素或預先存好的 SVG。"
    },
    "productLogin": {
      "appliesWhen": "project.sources.requiresLogin == true，或擷取時被導向登入頁（capture 輸出 gate productLogin）",
      "check": "使用者已以 pnpm run login 登入（登入資料存於 .auth/，Agent 不讀取）",
      "blocks": ["capture"],
      "ask": "先提醒：錄影會拍到登入後畫面上的一切（客戶名稱、email、金額），建議用展示用帳號，或經同意後把敏感處改成示意資料（domEditConsent）。再說明：會打開一個獨立的瀏覽器視窗（為了安全，不用平常的瀏覽器，所以要再登入一次；視窗上方可能寫著受自動測試軟體控制，這是正常的），請使用者像平常一樣登入，帳號密碼只在那個視窗輸入，Agent 看不到；登入完成後關閉視窗即可。然後執行 pnpm run login。",
      "record": "不寫入 JSON；pnpm run login 輸出 signed in 即成立。輸出 no sign-in page was seen 時問使用者是否已登入",
      "onDecline": "不擷取需要登入的頁面：改用使用者提供的截圖或錄影（user-asset），或只擷取不需登入的公開頁面。"
    }
  },
  "steps": [
    {
      "id": "init",
      "title": "初始化專案",
      "command": "/video-init",
      "args": [
        { "name": "source", "required": false, "description": "產品網址、原始碼路徑或文字描述；故事影片為故事全文、大綱或點子。未提供時詢問使用者。" }
      ],
      "scope": "project",
      "requires": {
        "other": ["目前目錄為空，或尚無 video.project.json"]
      },
      "writes": [
        { "path": "video.project.json" },
        { "path": "package.json" },
        { "path": "AGENTS.md" },
        { "path": "CLAUDE.md" },
        { "path": "schemas/" }
      ],
      "actions": [
        { "id": "scaffold", "do": "下載並解壓 /api/templates/product-video.zip，以 manifest.json 的 SHA-256 驗證完整性。" },
        { "id": "fill_project", "do": "填入 project.id（新 UUID）、name、kind（產品介紹為 product，故事影片為 story）、sources、language、format。product 至少需要一種產品來源；story 需要 sources.story 或 sources.description。向使用者確認 targetAudience 與 style；targetDurationSec 未指定時先用預設，analyze 後再確認。" },
        { "id": "install", "do": "pnpm install" },
        { "id": "check_tools", "do": "檢查 ffmpeg / ffprobe、Playwright 瀏覽器、所選 TTS 是否可用；缺少時告知安裝方式，不自行以系統權限安裝。" },
        { "id": "gates", "do": "依 gates 詢問 onlineTtsConsent 並記錄；sources.requiresLogin 為 true 時接著處理 productLogin（pnpm run login，使用者自行登入）。" },
        {
          "id": "validate",
          "do": "pnpm run validate",
          "transitions": [{ "target": "project", "to": "initialized" }]
        }
      ],
      "checkpoint": null,
      "guide": "skills/product-video/workflow.md#init"
    },
    {
      "id": "analyze",
      "title": "分析產品",
      "command": "/video-analyze",
      "kinds": ["product"],
      "scope": "project",
      "requires": { "projectStatus": ["initialized", "analyzed"], "gates": ["productLogin"] },
      "reads": [
        { "path": "video.project.json" },
        { "path": "project.sources.productUrl", "optional": true, "note": "以 Playwright 擷取頁面文字與主要截圖；requiresLogin 時先過 productLogin gate" },
        { "path": "project.sources.sourceCodePath", "optional": true, "note": "README、package.json、路由與頁面" }
      ],
      "writes": [
        { "path": "brief/product-brief.md" },
        { "path": "brief/style.json", "optional": true },
        { "path": "assets/brand/", "optional": true, "note": "擷取到的 logo、截圖" }
      ],
      "actions": [
        { "id": "collect", "do": "讀取所有提供的產品來源。" },
        { "id": "brief", "do": "產出 brief/product-brief.md：一句話定位、目標受眾、痛點、核心功能（≤5）、USP、品牌色與字型、CTA。" },
        {
          "id": "style",
          "do": "若有 referenceVideoUrl 或參考影片檔：以 FFmpeg 抽取關鍵影格，分析節奏、色調、字幕樣式、轉場，寫入 brief/style.json。取得不到影片時跳過並在 brief 註明，不臆測。",
          "when": "project.sources.referenceVideoUrl 或使用者提供參考影片"
        },
        {
          "id": "done",
          "do": "pnpm run state project --status analyzed",
          "transitions": [{ "target": "project", "from": ["initialized", "analyzed"], "to": "analyzed" }]
        }
      ],
      "checkpoint": "摘要產品重點，確認觀看對象與影片風格，並依內容提出 2–3 個長度選項（附估算理由與建議）。使用者確認後以 pnpm run state 寫入 project.targetAudience、project.style、project.format.targetDurationSec，才可進入 storyboard。",
      "guide": "skills/product-video/workflow.md#analyze"
    },
    {
      "id": "develop_story",
      "title": "整理故事",
      "command": "/video-story",
      "kinds": ["story"],
      "scope": "project",
      "requires": { "projectStatus": ["initialized", "analyzed"] },
      "reads": [
        { "path": "project.sources.story", "optional": true },
        { "path": "project.sources.description", "optional": true },
        { "path": "brief/story.md", "optional": true, "note": "修改已整理好的故事時" }
      ],
      "writes": [{ "path": "brief/story.md" }],
      "actions": [
        { "id": "assess", "do": "判斷使用者給的是完整故事、大綱還是只有點子。" },
        {
          "id": "develop",
          "do": "不是完整故事時，一次問一件事、每題附建議，和使用者一起補齊主角、想要什麼、阻礙、轉折、結局與想傳達的感覺；不替使用者決定結局等關鍵情節。",
          "when": "來源不是完整故事"
        },
        { "id": "write", "do": "寫 brief/story.md：一句話故事、角色表（名字、外型、個性）、依起承轉合分段的故事全文、想傳達的感覺與觀看對象。" },
        {
          "id": "done",
          "do": "pnpm run state project --status analyzed",
          "transitions": [{ "target": "project", "from": ["initialized", "analyzed"], "to": "analyzed" }]
        }
      ],
      "checkpoint": "用白話把故事從頭講一次（含角色表），確認情節與結局，並依故事長度提出 2–3 個影片長度選項。使用者確認後以 pnpm run state 寫入 project.targetAudience、project.style、project.format.targetDurationSec，才可進入 design。",
      "guide": "skills/story-video/story-guide.md#develop"
    },
    {
      "id": "design",
      "title": "美術與角色",
      "command": "/video-design",
      "kinds": ["story"],
      "scope": "project",
      "requires": { "projectStatus": ["analyzed", "designed"] },
      "reads": [{ "path": "brief/story.md" }],
      "writes": [
        { "path": "brief/design.md" },
        { "path": "assets/cast/", "note": "每個角色一個資料夾，放可組合的部件 SVG" },
        { "path": "assets/sets/", "optional": true, "note": "場景與道具 SVG" },
        { "path": "video.project.json", "note": "project.cast" }
      ],
      "actions": [
        { "id": "style", "do": "寫 brief/design.md：畫風、配色、線條粗細、角色比例與一致性規則。" },
        { "id": "art", "do": "為每個角色畫部件 SVG（身體、頭、表情、可動的手腳）並畫場景與道具；另外把所有角色與場景排成一張設定稿 brief/design-sheet.svg 讓使用者看。" },
        { "id": "voices", "do": "為每個角色挑聲音，用 pnpm run tts --sample 試聽（需要時先依 onlineTtsConsent 取得同意）。" },
        { "id": "cast", "do": "以 pnpm run state project --patch-file 寫入 project.cast（id、name、description、voice、art）。" },
        {
          "id": "done",
          "do": "pnpm run state project --status designed",
          "transitions": [{ "target": "project", "from": ["analyzed", "designed"], "to": "designed" }]
        }
      ],
      "checkpoint": "給使用者看設定稿與每個角色的試聽檔，逐一確認外型與聲音。使用者確認前不得進入 storyboard；之後改了角色美術或聲音，用到的 scene 都要重做。",
      "guide": "skills/story-video/design-guide.md"
    },
    {
      "id": "storyboard",
      "title": "規劃分鏡與旁白",
      "command": "/video-storyboard",
      "scope": "project",
      "requires": { "projectStatus": ["analyzed", "designed", "script_generated", "producing", "ready_to_assemble", "completed"] },
      "reads": [
        { "path": "brief/product-brief.md", "optional": true, "note": "product 專案" },
        { "path": "brief/story.md", "optional": true, "note": "story 專案；另讀 brief/design.md 與 project.cast" },
        { "path": "{dir}/scene.json", "optional": true, "note": "重新規劃時讀取現有分鏡" },
        { "path": "{dir}/script.md", "optional": true, "note": "重新規劃時讀取現有分鏡" },
        { "path": "brief/style.json", "optional": true }
      ],
      "writes": [
        { "path": "{dir}/scene.json" },
        { "path": "{dir}/script.md" },
        { "path": "video.project.json", "note": "scenes 陣列" }
      ],
      "actions": [
        { "id": "plan", "do": "規劃 3–8 個 scene。product 建議骨架：hook → problem → solution → feature → benefit → cta；story 依起承轉合：opening → setup → conflict → climax → resolution → ending，做法見 story-video Skill 的 story-guide.md#storyboard。" },
        {
          "id": "revise",
          "do": "已有 scene 時改為修訂現有分鏡：只改使用者要求的部分，先提出逐段的保留／修改／新增／移除清單並等使用者確認，確認後才寫入；保留的 scene 沿用原 id 與目錄。此時 write 只建立新增的 scene，register 只更新 scenes 陣列，不設定 project 狀態（state 會依 scene 自動重算）。最後執行 sync，只重做有變更的 scene 並重新合成。做法見 script-guide.md#revise。",
          "when": "project.scenes 不為空"
        },
        { "id": "write", "do": "每個 scene 建立 scenes/{三位數}-{slug}/scene.json 與 script.md，status 為 draft，durationSec 預設 null。" },
        { "id": "timing", "do": "估算旁白總時長（中文約 4 字/秒、英文約 2.5 字/秒），需接近 project.format.targetDurationSec。" },
        {
          "id": "register",
          "do": "pnpm run state project --patch-file <patch>（將 scenes 依播放順序寫入 video.project.json）",
          "transitions": [
            { "target": "scene", "to": "draft" },